<?xml version="1.0" encoding="utf-8"?>
<Flower xmlns="FlowerNS"
                xmlns:xsi="http://www.w3.org/2001/XMLSchema-instance"
                xsi:schemaLocation="FlowerNS Flower.xsd">
    <flowers>
        <flower>
            <flowerID>1</flowerID>
            <name>Rose</name>
            <soil>Chernozems</soil>
            <origin>Ukraine</origin>
            <visualParameters>
                <stalkColor>green</stalkColor>
                <leafColor>green</leafColor>
                <size>1500</size>
            </visualParameters>
            <growingTips>
                <temperature>3</temperature>
                <light>true</light>
                <water>300</water>
            </growingTips>
            <multiplying>Leaves</multiplying>
        </flower>
        <flower>
            <flowerID>2</flowerID>
            <name>Cucumber</name>
            <soil>Podzols</soil>
            <origin>Russia</origin>
            <visualParameters>
                <stalkColor>green</stalkColor>
                <leafColor>green</leafColor>
                <size>5000</size>
            </visualParameters>
            <growingTips>
                <temperature>4</temperature>
                <light>true</light>
                <water>2000</water>
            </growingTips>
            <multiplying>Cuttings</multiplying>
        </flower>
        <flower>
            <flowerID>3</flowerID>
            <name>Carrot</name>
            <soil>Brown Ears</soil>
            <origin>Argentina</origin>
            <visualParameters>
                <stalkColor>orange</stalkColor>
                <leafColor>green</leafColor>
                <size>400</size>
            </visualParameters>
            <growingTips>
                <temperature>3</temperature>
                <light>false</light>
                <water>350</water>
            </growingTips>
            <multiplying>Seeds</multiplying>
        </flower>

        <flower>
            <flowerID>4</flowerID>
            <name>Test1</name>
            <soil>Brown Ears</soil>
            <origin>Argentina</origin>
            <visualParameters>
                <stalkColor>orange</stalkColor>
                <leafColor>green</leafColor>
                <size>400</size>
            </visualParameters>
            <growingTips>
                <temperature>3</temperature>
                <light>false</light>
                <water>350</water>
            </growingTips>
            <multiplying>Leaves</multiplying>
        </flower>
        <flower>
            <flowerID>5</flowerID>
            <name>Test2</name>
            <soil>Brown Ears</soil>
            <origin>Argentina</origin>
            <visualParameters>
                <stalkColor>orange</stalkColor>
                <leafColor>green</leafColor>
                <size>400</size>
            </visualParameters>
            <growingTips>
                <temperature>3</temperature>
                <light>false</light>
                <water>350</water>
            </growingTips>
            <multiplying>Cuttings</multiplying>
        </flower>
    </flowers>
</Flower>